﻿http://zakupki.gov.ru/epz/order/notice/zk44/view/common-info.html?regNumber=0328300044716000022;1; 24.10.2016;Фонд ОМС;Запрос котировок; Владимирская обл;Закупка сантехнических товаров;15 716,94
http://zakupki.gov.ru/epz/order/notice/ea44/view/common-info.html?regNumber=0332300267516000064;1; 24.10.2016;средства бюджетного учреждения;Электронный аукцион; Нижегородская обл;;199 833,33
http://zakupki.gov.ru/epz/order/notice/zk44/view/common-info.html?regNumber=0332100016516000082;1; 24.10.2016;федеральный бюджет (дополнительный источник бюджетного финансирования).;Запрос котировок; Нижегородская обл;Труба металлическая водопроводная Ф76 мм S =4 мм  ;25 472,50
http://zakupki.gov.ru/epz/order/notice/ea44/view/common-info.html?regNumber=0332200034116000002;1; 24.10.2016;бюджетные средства Нижегородской области;Электронный аукцион; Нижегородская обл;приобретение шприцов-вакцинаторов с трубкой;225 000,00
http://zakupki.gov.ru/223/purchase/public/purchase/info/common-info.html?noticeId=4371153&epz=true&style44=false;1; 24.10.2016;;Открытый аукцион в электронной форме; обл НИЖЕГОРОДСКАЯ;ОА-С-ТНМ-099.17 «Краны шаровые с электроприводом для нужд Великолукского завода «Транснефтемаш» АО «Транснефть - Верхняя Волга;949 640,87
http://zakupki.gov.ru/epz/order/notice/zk44/view/common-info.html?regNumber=0132300019516000042;1; 24.10.2016;Бюджет города Нижнего Новгорода на 2016 год, в рамках муниципальной программы «Жилищно-коммунальное хозяйство города Нижнего Новгорода».
КБК 133 0501 07П0245010 243 1 1 101 615 225 320;Запрос котировок; Нижегородская обл;Выполнение работ по капитальному ремонту жилых помещений муниципального фонда (замена сантехнического оборудования) на территории Приокского района г. Нижнего Новгорода в 2016 году.;
